{
  "schemaVersion": "1",
  "target": "Dedicated Photon",
  "result": "UNVERIFIED",
  "environment": {"sparkVersion": "", "runtimeVersion": "", "scalaVersion": "2.13", "jdkVersion": "17"},
  "run": {"workspaceId": "", "jobId": "", "runId": "", "taskRunId": ""},
  "plan": {"profileId": "", "operatorSummary": [], "evidenceSource": ""},
  "rewrites": [],
  "fallbacks": [],
  "claim": "Populate only from supported Databricks plan/query-profile evidence."
}
